{
  "$schema": "https://json-schema.org/draft/2020-12/schema",
  "$id": "https://rainpulse.local/contracts/events/radar-decode-requested.schema.json",
  "title": "RainPulse radar.decode.requested.v1 event",
  "type": "object",
  "additionalProperties": false,
  "required": ["schema_version", "event_id", "event_type", "occurred_at", "run_id", "job_id", "trace_id", "payload"],
  "properties": {
    "schema_version": { "const": "1.0" },
    "event_id": { "type": "string", "format": "uuid" },
    "event_type": { "const": "radar.decode.requested.v1" },
    "occurred_at": { "type": "string", "format": "date-time" },
    "run_id": { "type": "string", "format": "uuid" },
    "job_id": { "type": "string", "format": "uuid" },
    "trace_id": { "type": "string", "format": "uuid" },
    "payload": {
      "type": "object",
      "additionalProperties": false,
      "required": ["scan_id", "asset_id", "radar_id", "input_uri", "input_sha256", "input_size_bytes", "output_prefix", "source_format", "radar_config_version", "decoder_version"],
      "properties": {
        "scan_id": { "type": "string", "format": "uuid" },
        "asset_id": { "type": "string", "format": "uuid" },
        "radar_id": { "type": "string", "minLength": 1 },
        "input_uri": { "type": "string", "format": "uri" },
        "input_sha256": { "type": "string", "pattern": "^[a-f0-9]{64}$" },
        "input_size_bytes": { "type": "integer", "minimum": 1 },
        "output_prefix": { "type": "string", "format": "uri" },
        "source_format": { "type": "string", "minLength": 1 },
        "radar_config_version": { "type": "string", "minLength": 1 },
        "decoder_version": { "type": "string", "minLength": 1 }
      }
    }
  }
}
