{
  "schema_version": "1.0",
  "event_id": "20000000-0000-4000-8000-000000000001",
  "event_type": "radar.decode.requested.v1",
  "occurred_at": "2026-08-24T03:00:11Z",
  "run_id": "10000000-0000-4000-8000-000000000002",
  "job_id": "20000000-0000-4000-8000-000000000002",
  "trace_id": "10000000-0000-4000-8000-000000000003",
  "payload": {
    "scan_id": "10000000-0000-4000-8000-000000000004",
    "asset_id": "10000000-0000-4000-8000-000000000005",
    "radar_id": "synthetic_radar_01",
    "input_uri": "s3://rainpulse/radar/raw/synthetic_radar_01/2026/08/24/030000/sample.bin",
    "input_sha256": "ba7816bf8f01cfea414140de5dae2223b00361a396177a9cb410ff61f20015ad",
    "input_size_bytes": 3,
    "output_prefix": "s3://rainpulse/radar/normalized/synthetic_radar_01/2026/08/24/030000/",
    "source_format": "rainpulse-synthetic-volume",
    "radar_config_version": "synthetic-radar-01-v1",
    "decoder_version": "synthetic-decoder-v1"
  }
}
